[
  {
    "schema_name": "petra.author",
    "schema_version": "1.0.0",
    "author_id": "author_01K45F00000000000000000034",
    "revision": 1,
    "author_kind": "person",
    "display_name": "Mark D. Wilkinson",
    "identity_status": "provisional",
    "created_by": {
      "actor_id": "actor_01K45F00000000000000000001",
      "actor_kind": "service"
    },
    "created_at": "2026-09-02T20:05:00.000Z",
    "updated_at": "2026-09-02T20:05:00.000Z"
  },
  {
    "schema_name": "petra.author",
    "schema_version": "1.0.0",
    "author_id": "author_01K45F00000000000000000035",
    "revision": 1,
    "author_kind": "person",
    "display_name": "Michel Dumontier",
    "identity_status": "provisional",
    "created_by": {
      "actor_id": "actor_01K45F00000000000000000001",
      "actor_kind": "service"
    },
    "created_at": "2026-09-02T20:05:00.000Z",
    "updated_at": "2026-09-02T20:05:00.000Z"
  },
  {
    "schema_name": "petra.author",
    "schema_version": "1.0.0",
    "author_id": "author_01K45F00000000000000000036",
    "revision": 1,
    "author_kind": "person",
    "display_name": "IJsbrand Jan Aalbersberg",
    "identity_status": "provisional",
    "created_by": {
      "actor_id": "actor_01K45F00000000000000000001",
      "actor_kind": "service"
    },
    "created_at": "2026-09-02T20:05:00.000Z",
    "updated_at": "2026-09-02T20:05:00.000Z"
  },
  {
    "schema_name": "petra.author",
    "schema_version": "1.0.0",
    "author_id": "author_01K45F00000000000000000037",
    "revision": 1,
    "author_kind": "person",
    "display_name": "Gabrielle Appleton",
    "identity_status": "provisional",
    "created_by": {
      "actor_id": "actor_01K45F00000000000000000001",
      "actor_kind": "service"
    },
    "created_at": "2026-09-02T20:05:00.000Z",
    "updated_at": "2026-09-02T20:05:00.000Z"
  },
  {
    "schema_name": "petra.author",
    "schema_version": "1.0.0",
    "author_id": "author_01K45F00000000000000000038",
    "revision": 1,
    "author_kind": "person",
    "display_name": "Myles Axton",
    "identity_status": "provisional",
    "created_by": {
      "actor_id": "actor_01K45F00000000000000000001",
      "actor_kind": "service"
    },
    "created_at": "2026-09-02T20:05:00.000Z",
    "updated_at": "2026-09-02T20:05:00.000Z"
  },
  {
    "schema_name": "petra.author",
    "schema_version": "1.0.0",
    "author_id": "author_01K45F00000000000000000039",
    "revision": 1,
    "author_kind": "person",
    "display_name": "Arie Baak",
    "identity_status": "provisional",
    "created_by": {
      "actor_id": "actor_01K45F00000000000000000001",
      "actor_kind": "service"
    },
    "created_at": "2026-09-02T20:05:00.000Z",
    "updated_at": "2026-09-02T20:05:00.000Z"
  },
  {
    "schema_name": "petra.author",
    "schema_version": "1.0.0",
    "author_id": "author_01K45F0000000000000000003A",
    "revision": 1,
    "author_kind": "person",
    "display_name": "Niklas Blomberg",
    "identity_status": "provisional",
    "created_by": {
      "actor_id": "actor_01K45F00000000000000000001",
      "actor_kind": "service"
    },
    "created_at": "2026-09-02T20:05:00.000Z",
    "updated_at": "2026-09-02T20:05:00.000Z"
  },
  {
    "schema_name": "petra.author",
    "schema_version": "1.0.0",
    "author_id": "author_01K45F0000000000000000003B",
    "revision": 1,
    "author_kind": "person",
    "display_name": "Jan-Willem Boiten",
    "identity_status": "provisional",
    "created_by": {
      "actor_id": "actor_01K45F00000000000000000001",
      "actor_kind": "service"
    },
    "created_at": "2026-09-02T20:05:00.000Z",
    "updated_at": "2026-09-02T20:05:00.000Z"
  },
  {
    "schema_name": "petra.author",
    "schema_version": "1.0.0",
    "author_id": "author_01K45F0000000000000000003C",
    "revision": 1,
    "author_kind": "person",
    "display_name": "Luiz Bonino da Silva Santos",
    "identity_status": "provisional",
    "created_by": {
      "actor_id": "actor_01K45F00000000000000000001",
      "actor_kind": "service"
    },
    "created_at": "2026-09-02T20:05:00.000Z",
    "updated_at": "2026-09-02T20:05:00.000Z"
  },
  {
    "schema_name": "petra.author",
    "schema_version": "1.0.0",
    "author_id": "author_01K45F0000000000000000003D",
    "revision": 1,
    "author_kind": "person",
    "display_name": "Philip E. Bourne",
    "identity_status": "provisional",
    "created_by": {
      "actor_id": "actor_01K45F00000000000000000001",
      "actor_kind": "service"
    },
    "created_at": "2026-09-02T20:05:00.000Z",
    "updated_at": "2026-09-02T20:05:00.000Z"
  },
  {
    "schema_name": "petra.author",
    "schema_version": "1.0.0",
    "author_id": "author_01K45F0000000000000000003E",
    "revision": 1,
    "author_kind": "person",
    "display_name": "Jildau Bouwman",
    "identity_status": "provisional",
    "created_by": {
      "actor_id": "actor_01K45F00000000000000000001",
      "actor_kind": "service"
    },
    "created_at": "2026-09-02T20:05:00.000Z",
    "updated_at": "2026-09-02T20:05:00.000Z"
  },
  {
    "schema_name": "petra.author",
    "schema_version": "1.0.0",
    "author_id": "author_01K45F0000000000000000003F",
    "revision": 1,
    "author_kind": "person",
    "display_name": "Anthony J. Brookes",
    "identity_status": "provisional",
    "created_by": {
      "actor_id": "actor_01K45F00000000000000000001",
      "actor_kind": "service"
    },
    "created_at": "2026-09-02T20:05:00.000Z",
    "updated_at": "2026-09-02T20:05:00.000Z"
  },
  {
    "schema_name": "petra.author",
    "schema_version": "1.0.0",
    "author_id": "author_01K45F0000000000000000003G",
    "revision": 1,
    "author_kind": "person",
    "display_name": "Tim Clark",
    "identity_status": "provisional",
    "created_by": {
      "actor_id": "actor_01K45F00000000000000000001",
      "actor_kind": "service"
    },
    "created_at": "2026-09-02T20:05:00.000Z",
    "updated_at": "2026-09-02T20:05:00.000Z"
  },
  {
    "schema_name": "petra.author",
    "schema_version": "1.0.0",
    "author_id": "author_01K45F0000000000000000003H",
    "revision": 1,
    "author_kind": "person",
    "display_name": "Mercè Crosas",
    "identity_status": "provisional",
    "created_by": {
      "actor_id": "actor_01K45F00000000000000000001",
      "actor_kind": "service"
    },
    "created_at": "2026-09-02T20:05:00.000Z",
    "updated_at": "2026-09-02T20:05:00.000Z"
  },
  {
    "schema_name": "petra.author",
    "schema_version": "1.0.0",
    "author_id": "author_01K45F0000000000000000003J",
    "revision": 1,
    "author_kind": "person",
    "display_name": "Ingrid Dillo",
    "identity_status": "provisional",
    "created_by": {
      "actor_id": "actor_01K45F00000000000000000001",
      "actor_kind": "service"
    },
    "created_at": "2026-09-02T20:05:00.000Z",
    "updated_at": "2026-09-02T20:05:00.000Z"
  },
  {
    "schema_name": "petra.author",
    "schema_version": "1.0.0",
    "author_id": "author_01K45F0000000000000000003K",
    "revision": 1,
    "author_kind": "person",
    "display_name": "Olivier Dumon",
    "identity_status": "provisional",
    "created_by": {
      "actor_id": "actor_01K45F00000000000000000001",
      "actor_kind": "service"
    },
    "created_at": "2026-09-02T20:05:00.000Z",
    "updated_at": "2026-09-02T20:05:00.000Z"
  },
  {
    "schema_name": "petra.author",
    "schema_version": "1.0.0",
    "author_id": "author_01K45F0000000000000000003M",
    "revision": 1,
    "author_kind": "person",
    "display_name": "Scott Edmunds",
    "identity_status": "provisional",
    "created_by": {
      "actor_id": "actor_01K45F00000000000000000001",
      "actor_kind": "service"
    },
    "created_at": "2026-09-02T20:05:00.000Z",
    "updated_at": "2026-09-02T20:05:00.000Z"
  },
  {
    "schema_name": "petra.author",
    "schema_version": "1.0.0",
    "author_id": "author_01K45F0000000000000000003N",
    "revision": 1,
    "author_kind": "person",
    "display_name": "Chris T. Evelo",
    "identity_status": "provisional",
    "created_by": {
      "actor_id": "actor_01K45F00000000000000000001",
      "actor_kind": "service"
    },
    "created_at": "2026-09-02T20:05:00.000Z",
    "updated_at": "2026-09-02T20:05:00.000Z"
  },
  {
    "schema_name": "petra.author",
    "schema_version": "1.0.0",
    "author_id": "author_01K45F0000000000000000003P",
    "revision": 1,
    "author_kind": "person",
    "display_name": "Richard Finkers",
    "identity_status": "provisional",
    "created_by": {
      "actor_id": "actor_01K45F00000000000000000001",
      "actor_kind": "service"
    },
    "created_at": "2026-09-02T20:05:00.000Z",
    "updated_at": "2026-09-02T20:05:00.000Z"
  },
  {
    "schema_name": "petra.author",
    "schema_version": "1.0.0",
    "author_id": "author_01K45F0000000000000000003Q",
    "revision": 1,
    "author_kind": "person",
    "display_name": "Alejandra Gonzalez-Beltran",
    "identity_status": "provisional",
    "created_by": {
      "actor_id": "actor_01K45F00000000000000000001",
      "actor_kind": "service"
    },
    "created_at": "2026-09-02T20:05:00.000Z",
    "updated_at": "2026-09-02T20:05:00.000Z"
  },
  {
    "schema_name": "petra.author",
    "schema_version": "1.0.0",
    "author_id": "author_01K45F0000000000000000003R",
    "revision": 1,
    "author_kind": "person",
    "display_name": "Alasdair J.G. Gray",
    "identity_status": "provisional",
    "created_by": {
      "actor_id": "actor_01K45F00000000000000000001",
      "actor_kind": "service"
    },
    "created_at": "2026-09-02T20:05:00.000Z",
    "updated_at": "2026-09-02T20:05:00.000Z"
  },
  {
    "schema_name": "petra.author",
    "schema_version": "1.0.0",
    "author_id": "author_01K45F0000000000000000003S",
    "revision": 1,
    "author_kind": "person",
    "display_name": "Paul Groth",
    "identity_status": "provisional",
    "created_by": {
      "actor_id": "actor_01K45F00000000000000000001",
      "actor_kind": "service"
    },
    "created_at": "2026-09-02T20:05:00.000Z",